{
  "$id": "opentronsLabwareSchemaV2",
  "$schema": "http://json-schema.org/draft-07/schema#",
  "definitions": {
    "positiveNumber": {
      "type": "number",
      "minimum": 0
    }
  },
  "type": "object",
  "additionalProperties": false,
  "required": [
    "otId",
    "deprecated",
    "metadata",
    "brand",
    "parameters",
    "cornerOffsetFromSlot",
    "ordering",
    "dimensions",
    "wells"
  ],
  "properties": {
    "otId": {
      "description": "Unique internal ID generated using UUID",
      "type": "string"
    },
    "deprecated": {
      "description": "Flag specifying whether a labware is deprecated or not",
      "type": "boolean"
    },
    "metadata": {
      "type": "object",
      "description": "Properties used for search and display",
      "additionalProperties": false,
      "required": ["displayName", "displayCategory", "displayVolumeUnits"],
      "properties": {
        "displayName": {
          "description": "Easy to remember name of labware",
          "type": "string"
        },
        "displayCategory": {
          "description": "Label used in UI to categorize labware",
          "type": "string",
          "enum": [
            "tipRack",
            "tubeRack",
            "trough",
            "trash",
            "wellPlate",
            "other"
          ]
        },
        "displayVolumeUnits": {
          "description": "Volume units for display",
          "type": "string",
          "enum": ["ÂµL", "mL", "L"]
        },
        "tags": {
          "type": "array",
          "description": "List of descriptions for a given labware",
          "items": {
            "type": "string"
          }
        }
      }
    },
    "brand": {
      "type": "object",
      "description": "Also for searchability, so that users know exactly which labware this was modeled off",
      "additionalProperties": false,
      "required": ["brand"],
      "properties": {
        "brandId": {
          "type": "array",
          "description": "An array of manufacture numbers pertaining to a given labware",
          "items": {
            "type": "string"
          }
        },
        "brand": {
          "type": "string"
        }
      }
    },
    "parameters": {
      "type": "object",
      "description": "Internal describers used to determine pipette movement to labware",
      "additionalProperties": false,
      "required": [
        "format",
        "isTiprack",
        "loadName",
        "isMagneticModuleCompatible"
      ],
      "properties": {
        "format": {
          "description": "Property to determine compatibility with multichannel pipette",
          "type": "string",
          "enum": ["96Standard", "384Standard", "trough", "irregular", "trash"]
        },
        "quirks": {
          "description": "Property to classify a specific behavior this labware should have",
          "type": "array",
          "items": {
            "type": "string"
          }
        },
        "isTiprack": {
          "description": "Flag marking whether a labware is a tiprack or not",
          "type": "boolean"
        },
        "tipLength": {
          "description": "Required if labware is tiprack, specifies length of tip from drawing or as measured with calipers",
          "$ref": "#/definitions/positiveNumber"
        },
        "tipOverlap": {
          "description": "Required if labware is tiprack, specifies the length of the area of the tip that overlaps the nozzle of the pipette",
          "$ref": "#/definitions/positiveNumber"
        },
        "loadName": {
          "description": "Generated unique name of container",
          "type": "string",
          "pattern": "^[a-z0-9._]+$"
        },
        "isMagneticModuleCompatible": {
          "description": "Flag marking whether a labware is compatible by default with the Magnetic Module",
          "type": "boolean"
        },
        "magneticModuleEngageHeight": {
          "description": "Distance to move magnetic module magnets to engage",
          "$ref": "#/definitions/positiveNumber"
        }
      }
    },
    "ordering": {
      "type": "array",
      "description": "Generated array that keeps track of how wells should be ordered in a labware",
      "items": {
        "type": "array",
        "items": {
          "type": "string"
        }
      }
    },
    "cornerOffsetFromSlot": {
      "type": "object",
      "additionalProperties": false,
      "description": "Distance from left-front-bottom corner of slot to left-front-bottom corner of labware",
      "required": ["x", "y", "z"],
      "properties": {
        "x": { "type": "number" },
        "y": { "type": "number" },
        "z": { "type": "number" }
      }
    },
    "dimensions": {
      "type": "object",
      "additionalProperties": false,
      "description": "Outer dimensions of a labware",
      "required": ["overallWidth", "overallHeight", "overallLength"],
      "properties": {
        "overallWidth": {
          "$ref": "#/definitions/positiveNumber"
        },
        "overallHeight": {
          "$ref": "#/definitions/positiveNumber"
        },
        "overallLength": {
          "$ref": "#/definitions/positiveNumber"
        }
      }
    },
    "wells": {
      "type": "object",
      "description": "Unordered object of well objects with position and dimensional information",
      "patternProperties": {
        "['A' - 'Z'][*]": {
          "type": "object",
          "additionalProperties": false,
          "required": ["depth", "shape", "totalLiquidVolume", "x", "y", "z"],
          "oneOf": [
            { "required": ["width", "length"] },
            { "required": ["diameter"] }
          ],
          "not": {
            "anyOf": [
              { "required": ["diameter", "width"] },
              { "required": ["diameter", "length"] }
            ]
          },
          "properties": {
            "depth": { "$ref": "#/definitions/positiveNumber" },
            "x": {
              "description": "X location of center-top of well in reference to left-front-bottom of labware",
              "$ref": "#/definitions/positiveNumber"
            },
            "y": {
              "description": "Y location of center-top of well in reference to left-front-bottom of labware",
              "$ref": "#/definitions/positiveNumber"
            },
            "z": {
              "description": "Z location of center-top of well in reference to left-front-bottom of labware",
              "$ref": "#/definitions/positiveNumber"
            },
            "totalLiquidVolume": {
              "description": "Total well, tube, or tip volume in microliters",
              "$ref": "#/definitions/positiveNumber"
            },
            "width": { "$ref": "#/definitions/positiveNumber" },
            "length": { "$ref": "#/definitions/positiveNumber" },
            "diameter": { "$ref": "#/definitions/positiveNumber" },
            "shape": {
              "description": "If rectangular, use length and width; otherwise use diameter",
              "type": "string",
              "enum": ["rectangular", "circular"]
            }
          }
        }
      }
    }
  }
}
